{
  "schema_version": "mainframe-env.topic-manifest@1",
  "target_version": "0.15.0",
  "baseline_id": "ibm-mq-9.4-rfh2-sources-2026-09-12",
  "subsystem": "mq",
  "product": "SSFKSJ_9.4.0",
  "book_label": "IBM MQ 9.4 RFH2 header, property mapping and conversion option source-review scope",
  "book_href": "SSFKSJ_9.4.0/refdev/q099240_.html",
  "snapshot_date": "2026-09-12",
  "toc_url": "https://www.ibm.com/docs/api/v1/toc/SSFKSJ_9.4.0?lang=en",
  "toc_sha256": "5b23147424db490f5292bd56afe1a0dd2a6ccdde3a08388a79d599998e002bd4",
  "content_url_template": "https://www.ibm.com/docs/api/v1/content/{topic_path}?parsebody=true&lang=en",
  "topic_count": 15,
  "total_bytes": 478640,
  "topic_manifest_digest_definition": "sha256 over the concatenation, sorted by topic_path, of one \"<topic_path> <sha256>\\n\" line per topic, each <sha256> written as bare lowercase hex",
  "topic_manifest_digest": "b0a9b4656c10ea8ec8a23999935d47cf559f5164a707a0aa3e078d3d2266afdc",
  "coverage_credit": 0,
  "retained_in_repository": false,
  "topics": [
    {
      "topic_path": "SSFKSJ_9.4.0/develop/q032000_.html",
      "sha256": "5a764b67e5b4781b3367ab4fea1025fd889763b09ace7648a389c8d26fe90261",
      "bytes": 32116,
      "last_modified": "2026-05-07"
    },
    {
      "topic_path": "SSFKSJ_9.4.0/refdev/q090390_.html",
      "sha256": "dabdcb4f88c77e910196977ddbf997062279d5b6c1f68a295d8350168d966d14",
      "bytes": 6232,
      "last_modified": "2026-05-18"
    },
    {
      "topic_path": "SSFKSJ_9.4.0/refdev/q091920_.html",
      "sha256": "2291573afd395a88c43c2c45263af810505ff2b646dfa934dd23cfb87c234700",
      "bytes": 6534,
      "last_modified": "2026-05-18"
    },
    {
      "topic_path": "SSFKSJ_9.4.0/refdev/q092560_.html",
      "sha256": "212601a607089cbce083564a21d926fb34a6f36ea74f113686da10bd8ae31732",
      "bytes": 6747,
      "last_modified": "2026-05-18"
    },
    {
      "topic_path": "SSFKSJ_9.4.0/refdev/q099240_.html",
      "sha256": "84506097d7692134486ed80f945842fa2c4cfda9520e4b87ac2b7e90f8474033",
      "bytes": 60688,
      "last_modified": "2026-05-18"
    },
    {
      "topic_path": "SSFKSJ_9.4.0/refdev/q099245_.html",
      "sha256": "6814f2e61ba5bc3ba57de1388d77ede3e91f3b52170aad39b3f65ea984ab09a8",
      "bytes": 306945,
      "last_modified": "2026-05-18"
    },
    {
      "topic_path": "SSFKSJ_9.4.0/refdev/q104130_.html",
      "sha256": "e95504ed45475c5fe388a4196ef396f6387e1014729468f8cb3c2d4bec908eb2",
      "bytes": 4930,
      "last_modified": "2026-05-18"
    },
    {
      "topic_path": "SSFKSJ_9.4.0/refdev/q104140_.html",
      "sha256": "10a4e8b9f33db297f0720b9ca13b99efe3df15cabe5f256b4e9d28762db46176",
      "bytes": 4465,
      "last_modified": "2026-05-18"
    },
    {
      "topic_path": "SSFKSJ_9.4.0/refdev/q104150_.html",
      "sha256": "bfd82a515b9442e83ce47ce7ee821f833bf88b304edb452e4c6c741ac61b6a17",
      "bytes": 10076,
      "last_modified": "2026-05-18"
    },
    {
      "topic_path": "SSFKSJ_9.4.0/refdev/q104160_.html",
      "sha256": "6d8e70d7e1340acfbb53a56817bfcde477f96b508304dc61bd266dfbb01d6467",
      "bytes": 6690,
      "last_modified": "2026-05-18"
    },
    {
      "topic_path": "SSFKSJ_9.4.0/refdev/q104170_.html",
      "sha256": "13eb34a4d4ac467420828a62f3d80e3c8a4aeb358c80b9522bf074eb0404cdea",
      "bytes": 3921,
      "last_modified": "2026-05-18"
    },
    {
      "topic_path": "SSFKSJ_9.4.0/refdev/q104180_.html",
      "sha256": "847a1c610ad46f47f846bb187f4b20c5ea12db5e34f9ff5ad41556738a2bf8e0",
      "bytes": 2382,
      "last_modified": "2026-05-18"
    },
    {
      "topic_path": "SSFKSJ_9.4.0/refdev/q104190_.html",
      "sha256": "b21165a9c3cfc855c4f877e6c42d9085fa2249b24982bb683893becc7e307967",
      "bytes": 12054,
      "last_modified": "2026-05-18"
    },
    {
      "topic_path": "SSFKSJ_9.4.0/refdev/q104200_.html",
      "sha256": "5211aa387bf4ec24fe7664b41b099a6614c46ec0856dddbe2885c3c0d90031f8",
      "bytes": 10509,
      "last_modified": "2026-05-18"
    },
    {
      "topic_path": "SSFKSJ_9.4.0/refdev/q104210_.html",
      "sha256": "75c2f0002f130e75affe7303c00d033ce3dbc21d170687d1879a75a3b9cdf0e5",
      "bytes": 4351,
      "last_modified": "2026-05-18"
    }
  ]
}
