{
  "baseline_id": "ibm-cics-ts-6x-cobol-calling-context-candidates-2026-09-12",
  "book_href": "SSJL4D_6.x/applications/developing/cobol/dfhp3_cobol_subprog_flow.html",
  "book_label": "COBOL calling lifecycle retained context candidates",
  "content_url_template": "https://www.ibm.com/docs/api/v1/content/{topic_path}?parsebody=true&lang=en",
  "coverage_credit": 0,
  "product": "SSJL4D_6.x",
  "retained_in_repository": false,
  "schema_version": "mainframe-env.topic-manifest@1",
  "snapshot_date": "2026-09-12",
  "subsystem": "cics",
  "target_version": "0.9.0",
  "toc_sha256": "f65c51e52facc390c05f084e1d249ff19e68bf2d7f8d3f32d4d745faf622681a",
  "toc_url": "https://www.ibm.com/docs/api/v1/toc/cics-ts/6.x?lang=en",
  "topic_count": 2,
  "topic_manifest_digest": "1c9b95bc6d18c767a70269828fa36b8f0557e0543c43519c41abf06468e3f008",
  "topic_manifest_digest_definition": "sha256 over the concatenation, sorted by topic_path, of one \"<topic_path> <sha256>\\n\" line per topic, each <sha256> written as bare lowercase hex",
  "topics": [
    {
      "bytes": 4466,
      "last_modified": "2026-01-16",
      "sha256": "19c888aa15e7d8b01333dd099c20f8bcb80ac1b507668346939e140b2ceb8f8b",
      "topic_path": "SSJL4D_6.x/applications/developing/cobol/dfhp3_cobol_subprog_flow.html"
    },
    {
      "bytes": 12762,
      "last_modified": "2026-01-16",
      "sha256": "ff6330589c9ff88c9292aac548c37d3c50de369fdcef485125d6165fca414d9c",
      "topic_path": "SSJL4D_6.x/applications/developing/cobol/dfhp3_cobol_subprog_rules.html"
    }
  ],
  "total_bytes": 17228
}
