{
  "baseline_id": "ibm-cics-ts-6x-bms-map-origin-2026-09-14",
  "book_href": "SSJL4D_6.x/applications/designing/dfhp3cd.html",
  "book_label": "CICS BMS map origin semantic slice",
  "content_url_template": "https://www.ibm.com/docs/api/v1/content/{topic_path}?parsebody=true&lang=en",
  "coverage_credit": 0,
  "product": "SSJL4D_6.x",
  "retained_in_repository": false,
  "schema_version": "mainframe-env.topic-manifest@1",
  "snapshot_date": "2026-09-14",
  "subsystem": "cics",
  "target_version": "0.9.0",
  "toc_sha256": "f65c51e52facc390c05f084e1d249ff19e68bf2d7f8d3f32d4d745faf622681a",
  "toc_url": "https://www.ibm.com/docs/api/v1/toc/cics-ts/6.x?lang=en",
  "topic_count": 2,
  "topic_manifest_digest": "a848e11cb75baf44edbff10234516207756ec2d17beab3619cddf8ec413003cc",
  "topic_manifest_digest_definition": "sha256 over the concatenation, sorted by topic_path, of one \"<topic_path> <sha256>\\n\" line per topic, each <sha256> written as bare lowercase hex",
  "topics": [
    {
      "bytes": 4069,
      "last_modified": "2026-01-16",
      "sha256": "e86190106cf43d40b79fdf2e6e64f40ffa0cef4f5b56a3e4894c9aec95b0eb72",
      "topic_path": "SSJL4D_6.x/applications/designing/dfhp3cd.html"
    },
    {
      "bytes": 179167,
      "last_modified": "2026-01-16",
      "sha256": "4c3fc95c18540c56a993770d06ed82a61ac2eec2886c0d24e46c055b2b2bd38c",
      "topic_path": "SSJL4D_6.x/reference-applications/bms/dfhp47g.html"
    }
  ],
  "total_bytes": 183236
}
