{
  "schema_version": "mainframe-env.topic-manifest@1",
  "target_version": "0.14.0",
  "baseline_id": "ibm-ims-15.6-ssa-position-commands-2026-09-11",
  "subsystem": "ims",
  "product": "SSEPH2_15.6.0",
  "book_label": "IMS 15.6 F/U/V/W command archive supplement for mainframe-env 0.14",
  "book_href": "SSEPH2_15.6.0/com.ibm.ims156.doc.apr/ims_fcmdcode.htm",
  "snapshot_date": "2026-09-11",
  "toc_url": "https://www.ibm.com/docs/api/v1/toc/ims/15.6.0?lang=en",
  "toc_sha256": "aaa12586b41e9994921bfddce588b186dc5bdda8ab253db054ae1e5014d6f618",
  "content_url_template": "https://www.ibm.com/docs/api/v1/content/{topic_path}?parsebody=true&lang=en",
  "topic_count": 4,
  "total_bytes": 18985,
  "topic_manifest_digest_definition": "sha256 over the concatenation, sorted by topic_path, of one \"<topic_path> <sha256>\\n\" line per topic, each <sha256> written as bare lowercase hex",
  "topic_manifest_digest": "f99728026ed7f14fcc8e104678bc55939581af2defee68385bc3bf35b170e8b9",
  "coverage_credit": 0,
  "retained_in_repository": false,
  "topics": [
    {
      "topic_path": "SSEPH2_15.6.0/com.ibm.ims156.doc.apr/ims_fcmdcode.htm",
      "sha256": "425e453bd01c99b47f2a513fcf74678a9b5ff84cd16c719d83696053e9e47cd0",
      "bytes": 7545,
      "last_modified": "not-recorded-in-retained-archive"
    },
    {
      "topic_path": "SSEPH2_15.6.0/com.ibm.ims156.doc.apr/ims_ucmdcode.htm",
      "sha256": "dd714045f66d410138eaacc9c0cae5d2da9d2c18d35913f31ba041db60950613",
      "bytes": 5269,
      "last_modified": "not-recorded-in-retained-archive"
    },
    {
      "topic_path": "SSEPH2_15.6.0/com.ibm.ims156.doc.apr/ims_vcmdcode.htm",
      "sha256": "30556749e146ef15dacf630a10c5538186d06765657a236351a7babef2de8b26",
      "bytes": 3557,
      "last_modified": "not-recorded-in-retained-archive"
    },
    {
      "topic_path": "SSEPH2_15.6.0/com.ibm.ims156.doc.apr/ims_wcmdcode.htm",
      "sha256": "44bbf1257b5b6e426984c66c008cb065a84a0a37afdac5be4a743be05dbf8b56",
      "bytes": 2614,
      "last_modified": "not-recorded-in-retained-archive"
    }
  ]
}
