{
  "baseline_id": "ibm-cics-ts-6x-conversation-extract-cvda-2026-09-24",
  "book_href": "SSJL4D_6.x/reference-applications/commands-api/dfha80c.html",
  "book_label": "CICS conversation extract CVDA source supplement",
  "content_url_template": "https://www.ibm.com/docs/api/v1/content/{topic_path}?parsebody=true&lang=en",
  "coverage_credit": 0,
  "product": "SSJL4D_6.x",
  "retained_in_repository": false,
  "schema_version": "mainframe-env.topic-manifest@1",
  "snapshot_date": "2026-09-24",
  "subsystem": "cics",
  "target_version": "0.9.0",
  "toc_sha256": "f65c51e52facc390c05f084e1d249ff19e68bf2d7f8d3f32d4d745faf622681a",
  "toc_url": "https://www.ibm.com/docs/api/v1/toc/cics-ts/6.x?lang=en",
  "topic_count": 1,
  "topic_manifest_digest": "5cb3be0964a59a86cecc72b625ade3ffb508d781665bd67c914684c33d17e11c",
  "topic_manifest_digest_definition": "sha256 over the concatenation, sorted by topic_path, of one \"<topic_path> <sha256>\\n\" line per topic, each <sha256> written as bare lowercase hex",
  "topics": [
    {
      "bytes": 356101,
      "last_modified": "2026-06-29",
      "sha256": "5b95b620971d42a9f57511b362f9a12dc04e9ad4b9c26f42cc8e7be943221381",
      "topic_path": "SSJL4D_6.x/reference-applications/commands-api/dfha80c.html"
    }
  ],
  "total_bytes": 356101
}
