{
  "baseline_id": "ibm-enterprise-cobol-6.5-numeric-move-pilot-2026-09-08",
  "book_href": "SS6SG3_6.5/lr/ref/rlpsmove.html",
  "book_label": "Enterprise COBOL 6.5 numeric MOVE pilot",
  "content_url_template": "https://www.ibm.com/docs/api/v1/content/{topic_path}?parsebody=true&lang=en",
  "coverage_credit": 0,
  "product": "SS6SG3_6.5",
  "retained_in_repository": false,
  "schema_version": "mainframe-env.topic-manifest@1",
  "snapshot_date": "2026-09-08",
  "subsystem": "cobol",
  "target_version": "0.9.0",
  "toc_sha256": "c3527d5e084e9749bef54ddf7bfdb1ecbbed94dd686c724417a4a3b669f671ce",
  "toc_url": "https://www.ibm.com/docs/api/v1/toc/SS6SG3_6.5?lang=en",
  "topic_count": 6,
  "topic_manifest_digest": "96b3f6d0d7eb08e90dc8ef465be1cc4549a4e431491d1b32c895cd659dbff067",
  "topic_manifest_digest_definition": "sha256 over the concatenation, sorted by topic_path, of one \"<topic_path> <sha256>\\n\" line per topic, each <sha256> written as bare lowercase hex",
  "topics": [
    {"bytes": 5118, "last_modified": "2026-01-30", "sha256": "243d5bc417ac02bcfd1ea5d28fef59af30506a0be3c770246023dc7679c5aa96", "topic_path": "SS6SG3_6.5/lr/ref/rldadar.html"},
    {"bytes": 12086, "last_modified": "2026-01-30", "sha256": "419d1cf396c6e1be313a877edf3b0d4ae976aaea6eaff12d608933c6113379d2", "topic_path": "SS6SG3_6.5/lr/ref/rlddeief.html"},
    {"bytes": 22481, "last_modified": "2026-07-29", "sha256": "45dcbbfb431e9b0aa40c56e3fd2a38714aee1f096363ca08bbf703a3bff9f19e", "topic_path": "SS6SG3_6.5/lr/ref/rlpsmove.html"},
    {"bytes": 5012, "last_modified": "2026-01-30", "sha256": "26c8f3342af770003c75a5197a7f9bdb807a854eef2cf5620b785338b8858b10", "topic_path": "SS6SG3_6.5/lr/ref/rlpsmovea.html"},
    {"bytes": 10353, "last_modified": "2026-01-30", "sha256": "39df1a380e925ff72acde9f5e3cc90b0e5681107f8a275a5a587a734c1fb7829", "topic_path": "SS6SG3_6.5/lr/rlpsmovea1.html"},
    {"bytes": 14808, "last_modified": "2026-01-30", "sha256": "c62fe5d91391bcf0fe2c6a4d2e5f5763feffc80adfc55ca859c66db8eed7ec05", "topic_path": "SS6SG3_6.5/lr/rlpsmovea2.html"}
  ],
  "total_bytes": 69858
}
