{
  "baseline_id": "ibm-cics-ts-6x-handle-aid-2026-09-14",
  "book_href": "SSJL4D_6.x/reference-applications/commands-api/dfhp4_handleaid.html",
  "book_label": "CICS HANDLE AID semantic slice",
  "content_url_template": "https://www.ibm.com/docs/api/v1/content/{topic_path}?parsebody=true&lang=en",
  "coverage_credit": 0,
  "product": "SSJL4D_6.x",
  "retained_in_repository": false,
  "schema_version": "mainframe-env.topic-manifest@1",
  "snapshot_date": "2026-09-14",
  "subsystem": "cics",
  "target_version": "0.9.0",
  "toc_sha256": "f65c51e52facc390c05f084e1d249ff19e68bf2d7f8d3f32d4d745faf622681a",
  "toc_url": "https://www.ibm.com/docs/api/v1/toc/cics-ts/6.x?lang=en",
  "topic_count": 2,
  "topic_manifest_digest": "8628fa60497ba97504966f9429927bf23acad1b101182ca2064c4db6c0a96d28",
  "topic_manifest_digest_definition": "sha256 over the concatenation, sorted by topic_path, of one \"<topic_path> <sha256>\\n\" line per topic, each <sha256> written as bare lowercase hex",
  "topics": [
    {
      "bytes": 45983,
      "last_modified": "2026-08-26",
      "sha256": "a9034f346d4b726d001d402228462c41535b3dba143749cbc91c58e3dc6c29bb",
      "topic_path": "SSJL4D_6.x/reference-applications/bms/dfhp4_bmsconstants.html"
    },
    {
      "bytes": 39370,
      "last_modified": "2026-08-26",
      "sha256": "a5270e56450bf8fda4bde93427d7345c9e3e590d36ecae03d3c0dee50a1ac627",
      "topic_path": "SSJL4D_6.x/reference-applications/commands-api/dfhp4_handleaid.html"
    }
  ],
  "total_bytes": 85353
}
